{
  "schema": "db.chip",
  "version": 1,
  "part": "74HC21",
  "title": "Dual 4-Input AND Gate",
  "family": "74HC",
  "package": {
    "kind": "DIP",
    "pins": 14
  },
  "status": {
    "datasheet": "verified",
    "pinout": "verified",
    "python_behavior": "modeled",
    "verilog_model": "modeled",
    "verilog_export": "tested",
    "tests": "tested"
  },
  "pins": [
    {
      "number": 1,
      "name": "1A",
      "direction": "input"
    },
    {
      "number": 2,
      "name": "1B",
      "direction": "input"
    },
    {
      "number": 3,
      "name": "NC",
      "direction": "nc"
    },
    {
      "number": 4,
      "name": "1C",
      "direction": "input"
    },
    {
      "number": 5,
      "name": "1D",
      "direction": "input"
    },
    {
      "number": 6,
      "name": "1Y",
      "direction": "output"
    },
    {
      "number": 7,
      "name": "GND",
      "direction": "power"
    },
    {
      "number": 8,
      "name": "2Y",
      "direction": "output"
    },
    {
      "number": 9,
      "name": "2A",
      "direction": "input"
    },
    {
      "number": 10,
      "name": "2B",
      "direction": "input"
    },
    {
      "number": 11,
      "name": "NC",
      "direction": "nc"
    },
    {
      "number": 12,
      "name": "2C",
      "direction": "input"
    },
    {
      "number": 13,
      "name": "2D",
      "direction": "input"
    },
    {
      "number": 14,
      "name": "VCC",
      "direction": "power"
    }
  ],
  "legacy_paths": {
    "pinout": "verilog/74xx/74hc21.v",
    "verilog": "verilog/74xx/74hc21.v",
    "python_behavior": "python/chiplib/chips.py",
    "verilog_export": "python/chiplib/netlist.py",
    "tests": [
      "python/tests/test_chips.py",
      "python/tests/test_netlist.py",
      "verilog/74xx/tests/tb_74xx_smoke.v"
    ]
  },
  "verilog": {
    "module": "ttl_74hc21",
    "file": "verilog/74xx/74hc21.v"
  },
  "python": {
    "factory": "chiplib.create_chip",
    "part": "74HC21"
  },
  "sources": [
    {
      "label": "Texas Instruments SN74HC21",
      "url": "https://www.ti.com/lit/ds/symlink/sn74hc21.pdf",
      "package_evidence": "N, 14-pin PDIP"
    }
  ]
}
