{
  "schema": "db.chip",
  "version": 1,
  "part": "74HC07",
  "title": "hex buffer with open-drain outputs",
  "family": "74HC",
  "package": {
    "kind": "DIP",
    "pins": 14
  },
  "status": {
    "datasheet": "verified",
    "pinout": "verified",
    "python_behavior": "not_applicable",
    "verilog_model": "modeled",
    "verilog_export": "tested",
    "tests": "tested"
  },
  "pins": [
    {
      "number": 1,
      "name": "1A",
      "direction": "input"
    },
    {
      "number": 2,
      "name": "1Y",
      "direction": "output"
    },
    {
      "number": 3,
      "name": "2A",
      "direction": "input"
    },
    {
      "number": 4,
      "name": "2Y",
      "direction": "output"
    },
    {
      "number": 5,
      "name": "3A",
      "direction": "input"
    },
    {
      "number": 6,
      "name": "3Y",
      "direction": "output"
    },
    {
      "number": 7,
      "name": "GND",
      "direction": "power"
    },
    {
      "number": 8,
      "name": "4Y",
      "direction": "output"
    },
    {
      "number": 9,
      "name": "4A",
      "direction": "input"
    },
    {
      "number": 10,
      "name": "5Y",
      "direction": "output"
    },
    {
      "number": 11,
      "name": "5A",
      "direction": "input"
    },
    {
      "number": 12,
      "name": "6Y",
      "direction": "output"
    },
    {
      "number": 13,
      "name": "6A",
      "direction": "input"
    },
    {
      "number": 14,
      "name": "VCC",
      "direction": "power"
    }
  ],
  "legacy_paths": {
    "pinout": "verilog/74HC/74hc07-pin.md",
    "verilog": "verilog/74HC/74hc07.v",
    "python_behavior": "python/chiplib/chips.py",
    "verilog_export": "python/chiplib/netlist.py",
    "tests": [
      "python/tests/test_chips.py",
      "python/tests/test_netlist.py",
      "verilog/74HC/tests/tb_74hc_smoke.v"
    ]
  },
  "verilog": {
    "module": "ttl_74hc07",
    "file": "verilog/74HC/74hc07.v"
  },
  "python": {
    "factory": "chiplib.create_chip",
    "part": "74HC07"
  },
  "sources": [
    {
      "label": "Legacy pinout datasheet source",
      "file": "../source/74HC07_STMICROELECTRONICS_23210.pdf"
    }
  ]
}
