{
  "schema": "db.chip",
  "version": 1,
  "part": "74HC574",
  "title": "Octal D-type flip-flop with 3-state outputs",
  "family": "74HC",
  "package": {
    "kind": "DIP",
    "pins": 20
  },
  "status": {
    "datasheet": "verified",
    "pinout": "verified",
    "python_behavior": "modeled",
    "verilog_model": "modeled",
    "verilog_export": "tested",
    "tests": "tested"
  },
  "pins": [
    {"number": 1, "name": "/OE", "direction": "input", "active_low": true},
    {"number": 2, "name": "1D", "direction": "input"},
    {"number": 3, "name": "2D", "direction": "input"},
    {"number": 4, "name": "3D", "direction": "input"},
    {"number": 5, "name": "4D", "direction": "input"},
    {"number": 6, "name": "5D", "direction": "input"},
    {"number": 7, "name": "6D", "direction": "input"},
    {"number": 8, "name": "7D", "direction": "input"},
    {"number": 9, "name": "8D", "direction": "input"},
    {"number": 10, "name": "GND", "direction": "power"},
    {"number": 11, "name": "CLK", "direction": "input"},
    {"number": 12, "name": "8Q", "direction": "output"},
    {"number": 13, "name": "7Q", "direction": "output"},
    {"number": 14, "name": "6Q", "direction": "output"},
    {"number": 15, "name": "5Q", "direction": "output"},
    {"number": 16, "name": "4Q", "direction": "output"},
    {"number": 17, "name": "3Q", "direction": "output"},
    {"number": 18, "name": "2Q", "direction": "output"},
    {"number": 19, "name": "1Q", "direction": "output"},
    {"number": 20, "name": "VCC", "direction": "power"}
  ],
  "legacy_paths": {
    "pinout": "verilog/74xx/74hc574.v",
    "verilog": "verilog/74xx/74hc574.v",
    "python_behavior": "python/chiplib/chips.py",
    "verilog_export": "python/chiplib/netlist.py",
    "tests": [
      "python/tests/test_chips.py",
      "python/tests/test_netlist.py",
      "verilog/74xx/tests/tb_74xx_smoke.v"
    ]
  },
  "verilog": {
    "module": "ttl_74hc574",
    "file": "verilog/74xx/74hc574.v",
    "export": {
      "kind": "structural_port_map",
      "ports": [
        {"name": "OE_bar", "pins": [1], "direction": "input"},
        {"name": "Clk", "pins": [11], "direction": "input"},
        {"name": "D", "pins": [2, 3, 4, 5, 6, 7, 8, 9], "direction": "input"},
        {"name": "Q", "pins": [19, 18, 17, 16, 15, 14, 13, 12], "direction": "output"}
      ],
      "output_pins": [12, 13, 14, 15, 16, 17, 18, 19],
      "sample_delay_ns": {"U5": 40, "U6": 40}
    }
  },
  "python": {
    "factory": "chiplib.create_chip",
    "part": "74HC574"
  },
  "sources": [
    {
      "label": "Texas Instruments SN74HC574",
      "url": "https://www.ti.com/lit/ds/symlink/sn74hc574.pdf",
      "package_evidence": "N, 20-pin PDIP"
    }
  ]
}
