{
  "schema": "db.chip",
  "version": 1,
  "part": "74HC153",
  "title": "Dual 4-Line to 1-Line Data Selector/Multiplexer",
  "family": "74HC",
  "package": {
    "kind": "DIP",
    "pins": 16
  },
  "status": {
    "datasheet": "verified",
    "pinout": "verified",
    "python_behavior": "not_applicable",
    "verilog_model": "modeled",
    "verilog_export": "tested",
    "tests": "tested"
  },
  "pins": [
    {
      "number": 1,
      "name": "/1G",
      "direction": "input",
      "active_low": true
    },
    {
      "number": 2,
      "name": "B",
      "direction": "input"
    },
    {
      "number": 3,
      "name": "1C3",
      "direction": "input"
    },
    {
      "number": 4,
      "name": "1C2",
      "direction": "input"
    },
    {
      "number": 5,
      "name": "1C1",
      "direction": "input"
    },
    {
      "number": 6,
      "name": "1C0",
      "direction": "input"
    },
    {
      "number": 7,
      "name": "1Y",
      "direction": "output"
    },
    {
      "number": 8,
      "name": "GND",
      "direction": "power"
    },
    {
      "number": 9,
      "name": "2Y",
      "direction": "output"
    },
    {
      "number": 10,
      "name": "2C0",
      "direction": "input"
    },
    {
      "number": 11,
      "name": "2C1",
      "direction": "input"
    },
    {
      "number": 12,
      "name": "2C2",
      "direction": "input"
    },
    {
      "number": 13,
      "name": "2C3",
      "direction": "input"
    },
    {
      "number": 14,
      "name": "A",
      "direction": "input"
    },
    {
      "number": 15,
      "name": "/2G",
      "direction": "input",
      "active_low": true
    },
    {
      "number": 16,
      "name": "VCC",
      "direction": "power"
    }
  ],
  "legacy_paths": {
    "pinout": "verilog/74xx/74hc153-pin.md",
    "verilog": "verilog/74xx/74hc153.v",
    "python_behavior": "python/chiplib/chips.py",
    "verilog_export": "python/chiplib/netlist.py",
    "tests": [
      "python/tests/test_chips.py",
      "python/tests/test_netlist.py",
      "verilog/74xx/tests/tb_74xx_smoke.v"
    ]
  },
  "verilog": {
    "module": "ttl_74hc153",
    "file": "verilog/74xx/74hc153.v"
  },
  "python": {
    "factory": "chiplib.create_chip",
    "part": "74HC153"
  },
  "sources": [
    {
      "label": "Texas Instruments SN74HC153",
      "url": "https://www.ti.com/lit/ds/symlink/sn74hc153.pdf",
      "package_evidence": "N, 16-pin PDIP"
    }
  ]
}
