{
  "schema": "db.chip",
  "version": 1,
  "part": "74HC162",
  "title": "presettable synchronous BCD decade counter, synchronous reset",
  "family": "74HC",
  "package": {
    "kind": "DIP",
    "pins": 16
  },
  "status": {
    "datasheet": "verified",
    "pinout": "verified",
    "python_behavior": "not_applicable",
    "verilog_model": "modeled",
    "verilog_export": "tested",
    "tests": "tested"
  },
  "pins": [
    {
      "number": 1,
      "name": "MR",
      "direction": "input"
    },
    {
      "number": 2,
      "name": "CP",
      "direction": "input"
    },
    {
      "number": 3,
      "name": "D0",
      "direction": "input"
    },
    {
      "number": 4,
      "name": "D1",
      "direction": "input"
    },
    {
      "number": 5,
      "name": "D2",
      "direction": "input"
    },
    {
      "number": 6,
      "name": "D3",
      "direction": "input"
    },
    {
      "number": 7,
      "name": "CEP",
      "direction": "input"
    },
    {
      "number": 8,
      "name": "GND",
      "direction": "power"
    },
    {
      "number": 9,
      "name": "PE",
      "direction": "input"
    },
    {
      "number": 10,
      "name": "CET",
      "direction": "input"
    },
    {
      "number": 11,
      "name": "Q3",
      "direction": "output"
    },
    {
      "number": 12,
      "name": "Q2",
      "direction": "output"
    },
    {
      "number": 13,
      "name": "Q1",
      "direction": "output"
    },
    {
      "number": 14,
      "name": "Q0",
      "direction": "output"
    },
    {
      "number": 15,
      "name": "TC",
      "direction": "output"
    },
    {
      "number": 16,
      "name": "VCC",
      "direction": "power"
    }
  ],
  "legacy_paths": {
    "pinout": "verilog/74xx/74hc162.v",
    "verilog": "verilog/74xx/74hc162.v",
    "python_behavior": "python/chiplib/chips.py",
    "verilog_export": "python/chiplib/netlist.py",
    "tests": [
      "python/tests/test_chips.py",
      "python/tests/test_netlist.py",
      "verilog/74xx/tests/tb_74xx_smoke.v"
    ]
  },
  "verilog": {
    "module": "ttl_74hc162",
    "file": "verilog/74xx/74hc162.v",
    "export": {
      "kind": "structural_port_map",
      "ports": [
        {
          "name": "Clear_bar",
          "pins": [
            1
          ],
          "direction": "input"
        },
        {
          "name": "Load_bar",
          "pins": [
            9
          ],
          "direction": "input"
        },
        {
          "name": "ENT",
          "pins": [
            10
          ],
          "direction": "input"
        },
        {
          "name": "ENP",
          "pins": [
            7
          ],
          "direction": "input"
        },
        {
          "name": "D",
          "pins": [
            3,
            4,
            5,
            6
          ],
          "direction": "input"
        },
        {
          "name": "Clk",
          "pins": [
            2
          ],
          "direction": "input"
        },
        {
          "name": "RCO",
          "pins": [
            15
          ],
          "direction": "output"
        },
        {
          "name": "Q",
          "pins": [
            14,
            13,
            12,
            11
          ],
          "direction": "output"
        }
      ],
      "output_pins": [
        11,
        12,
        13,
        14,
        15
      ]
    }
  },
  "python": {
    "factory": "chiplib.create_chip",
    "part": "74HC162"
  },
  "sources": [
    {
      "label": "Legacy pinout datasheet source",
      "file": "../source/74HC162_PHILIPS_15546.pdf"
    }
  ]
}
