{
  "schema": "db.chip",
  "version": 1,
  "part": "74HC138",
  "title": "3-line to 8-line decoder/demultiplexer with active-low outputs",
  "family": "74HC",
  "package": {
    "kind": "DIP",
    "pins": 16
  },
  "status": {
    "datasheet": "verified",
    "pinout": "verified",
    "python_behavior": "modeled",
    "verilog_model": "modeled",
    "verilog_export": "tested",
    "tests": "tested"
  },
  "pins": [
    {"number": 1, "name": "A", "direction": "input"},
    {"number": 2, "name": "B", "direction": "input"},
    {"number": 3, "name": "C", "direction": "input"},
    {"number": 4, "name": "/G2A", "direction": "input", "active_low": true},
    {"number": 5, "name": "/G2B", "direction": "input", "active_low": true},
    {"number": 6, "name": "G1", "direction": "input"},
    {"number": 7, "name": "/Y7", "direction": "output", "active_low": true},
    {"number": 8, "name": "GND", "direction": "power"},
    {"number": 9, "name": "/Y6", "direction": "output", "active_low": true},
    {"number": 10, "name": "/Y5", "direction": "output", "active_low": true},
    {"number": 11, "name": "/Y4", "direction": "output", "active_low": true},
    {"number": 12, "name": "/Y3", "direction": "output", "active_low": true},
    {"number": 13, "name": "/Y2", "direction": "output", "active_low": true},
    {"number": 14, "name": "/Y1", "direction": "output", "active_low": true},
    {"number": 15, "name": "/Y0", "direction": "output", "active_low": true},
    {"number": 16, "name": "VCC", "direction": "power"}
  ],
  "legacy_paths": {
    "pinout": "verilog/74xx/74hc138-pin.md",
    "verilog": "verilog/74xx/74hc138.v",
    "python_behavior": "python/chiplib/catalog.py",
    "verilog_export": "python/chiplib/netlist.py",
    "tests": [
      "python/tests/test_chips.py",
      "python/tests/test_netlist.py",
      "verilog/74xx/tests/tb_74xx_smoke.v"
    ]
  },
  "verilog": {
    "module": "ttl_74hc138",
    "file": "verilog/74xx/74hc138.v"
  },
  "python": {
    "factory": "chiplib.create_chip",
    "part": "74HC138"
  },
  "sources": [
    {
      "label": "Texas Instruments SN74HC138",
      "url": "https://www.ti.com/lit/ds/symlink/sn74hc138.pdf",
      "package_evidence": "N, 16-pin PDIP"
    }
  ]
}
